image,date,title,description
,2025-11-15,Microsoft Backs OpenAI Revenue Forecast,Nadella backs OpenAI's $100B revenue goal; cites need for massive capital in compute/R&D.
,2025-11-14,OpenAI Launches ChatGPT Group Chats,Pilot launched for shared spaces; enables multi-user collaboration while keeping individual data private.
,2025-11-14,Anthropic Discloses AI Cyberattack,"Chinese state hackers used ""Claude Code"" to attack tech/financial networks; rare AI-agent espionage case."
,2025-11-14,Google DeepMind Unveils SIMA 2,Gemini-powered agent follows natural language to reason and perform tasks in 3D games/environments.
,2025-11-13,New Apple AI Privacy Guidelines,App Store now requires explicit user permission before sharing data with 3rd-party AI models.
,2025-11-13,DeepMind Human-Aligned Vision Model,New technique aligns AI vision with human perception to fix algorithmic blind spots and categorization errors.
,2025-11-12,NVIDIA Q3 Earnings Anticipation,Projected $54.6B revenue driven by Blackwell GPU demand despite market volatility.
,3 AUG 2O25,UNESCO Justice Sector AI Training,Program launched in Bangkok to train Asian justice officials on ethical/legal AI risk management.
,18 AUG 2025,Indeed 2025 Workforce Trends,OpenAI's India-only tier is the biggest driver of LinkedIn posts this week, centered on affordability, UPI payments, and 10x higher limits versus free for messages, image generations, and uploads, plus longer memory and Indic-language support.
,18 AUG 2025,WHAT ₹399 GETS VS FREE — CHATGPT GO IN INDIA,OpenAI's India-only tier is the biggest driver of LinkedIn posts this week, centered on affordability, UPI payments, and 10x higher limits versus free for messages, image generations, and uploads, plus longer memory and Indic-language support
,03 AUG 2025,JIO IGNITES A TAX-TECH PRICE WAR AGAIN? WITH ₹24 ITR FILING,Reliance Jio’s finance arm has launched an in-app tax-filing, ITR submissions for ₹24, with expert-assisted options. Pushing mass-market adoption of digital tax tools while raising fresh questions on data privacy, upselling, and coverage limits for multi-income or capital-gains cases.